{
  "contract_version": "1.0.0",
  "session": {
    "session_uid": "sess_2026_04_26_ab12cd",
    "started_at_utc": "2026-04-26T18:30:00Z",
    "timezone_original": "America/New_York",
    "duration_seconds": 3720.4
  },
  "source": {
    "source_type": "craig",
    "audio_layout": "single_track_mixed",
    "artifact_sha256": "6f3b7a7e4e3b0f9a5c0d8e0d2e8a4f3a6e7d9b2c1a4f6d8e9f0a1b2c3d4e5f6a"
  },
  "privacy": {
    "pii_stripping_applied": true,
    "handle_redaction_applied": true,
    "spoken_name_redaction_applied": true,
    "guild_name_redacted": true
  },
  "participants": [
    {
      "participant_id": "p01",
      "chosen_name": "Alex",
      "display_label": "Alex",
      "speaker_tags": ["spk_0"]
    }
  ],
  "transcript": {
    "segments": [
      {
        "segment_id": "seg_0001",
        "start_ms": 1200,
        "end_ms": 8400,
        "participant_id": "p01",
        "speaker_label": "Alex",
        "text": "We should finalize release timing this week.",
        "topics": [
          {
            "topic_key": "release_planning",
            "source": "predefined",
            "confidence": 0.83
          }
        ]
      }
    ]
  }
}
